{
  "gateway_id": "gateway-example-ru-01",
  "onion_listener": "127.0.0.1:8443",
  "management_listener": "127.0.0.1:9090",
  "drain_grace_seconds": 300,
  "tls": {
    "certificate_chain": "/etc/onionroute-gateway/tls/server.crt",
    "private_key": "/etc/onionroute-gateway/tls/server.key"
  },
  "dns": {
    "upstreams": ["9.9.9.9:53", "149.112.112.112:53"],
    "query_timeout_ms": 3000,
    "max_response_bytes": 16384,
    "max_records": 64,
    "max_cname_depth": 8,
    "max_addresses": 16,
    "revalidate": true
  },
  "acl": {
    "blocked_ports": [22, 23, 25, 111, 135, 137, 138, 139, 445, 2375, 2376, 3306, 3389, 5432, 5900, 6379, 6443, 9051, 9151, 9200, 11211, 27017],
    "management_networks": ["10.200.0.0/24"],
    "emergency_deny_networks": [],
    "emergency_deny_host_suffixes": [],
    "cloud_metadata_ips": ["169.254.169.254", "100.100.100.200", "168.63.129.16"]
  },
  "limits": {
    "max_connections": 1024,
    "listen_backlog": 256,
    "max_sessions": 1024,
    "max_token_states": 4096,
    "max_sessions_per_token": 2,
    "max_streams_global": 16384,
    "max_streams_per_session": 128,
    "max_streams_per_token": 256,
    "connection_rate_per_second": 16,
    "connection_rate_burst": 32,
    "bandwidth_bytes_per_second": 8388608,
    "bandwidth_burst_bytes": 2097152,
    "token_byte_quota": 4294967296,
    "max_frame_bytes": 65536,
    "max_data_bytes": 32768,
    "max_token_bytes": 4096,
    "max_proof_bytes": 4096,
    "max_stream_window": 4194304,
    "initial_stream_window": 262144,
    "outbound_event_queue": 256,
    "handshake_timeout_ms": 10000,
    "auth_timeout_ms": 3000,
    "connect_timeout_ms": 10000,
    "io_timeout_ms": 120000,
    "session_ttl_seconds": 900,
    "scan_window_seconds": 60,
    "scan_distinct_destination_limit": 64,
    "circuit_failure_threshold": 32,
    "circuit_cooldown_seconds": 30
  },
  "privacy_events": {
    "enabled": true,
    "ttl_seconds": 900,
    "capacity": 4096,
    "coarse_bucket_seconds": 300
  }
}
